{
  "biomeId": "forgotten_castle",
  "branchPreviews": [
    {
      "fromRoomId": "combat_10",
      "hint": "reward",
      "toRoomId": "combat_11"
    },
    {
      "fromRoomId": "combat_10",
      "hint": "danger",
      "toRoomId": "combat_7"
    },
    {
      "fromRoomId": "combat_11",
      "hint": "danger",
      "toRoomId": "combat_10"
    },
    {
      "fromRoomId": "combat_11",
      "hint": "danger",
      "toRoomId": "combat_8"
    },
    {
      "fromRoomId": "combat_11",
      "hint": "reward",
      "toRoomId": "treasure"
    },
    {
      "fromRoomId": "combat_4",
      "hint": "danger",
      "toRoomId": "combat_7"
    },
    {
      "fromRoomId": "combat_5",
      "hint": "reward",
      "toRoomId": "combat_6"
    },
    {
      "fromRoomId": "combat_5",
      "hint": "danger",
      "toRoomId": "combat_8"
    },
    {
      "fromRoomId": "combat_6",
      "hint": "reward",
      "toRoomId": "combat_9"
    },
    {
      "fromRoomId": "combat_6",
      "hint": "danger",
      "toRoomId": "stairs"
    },
    {
      "fromRoomId": "combat_7",
      "hint": "danger",
      "toRoomId": "combat_10"
    },
    {
      "fromRoomId": "combat_7",
      "hint": "danger",
      "toRoomId": "combat_8"
    },
    {
      "fromRoomId": "combat_8",
      "hint": "reward",
      "toRoomId": "combat_11"
    },
    {
      "fromRoomId": "combat_8",
      "hint": "danger",
      "toRoomId": "combat_7"
    },
    {
      "fromRoomId": "combat_8",
      "hint": "reward",
      "toRoomId": "combat_9"
    },
    {
      "fromRoomId": "combat_9",
      "hint": "reward",
      "toRoomId": "combat_6"
    },
    {
      "fromRoomId": "combat_9",
      "hint": "danger",
      "toRoomId": "combat_8"
    },
    {
      "fromRoomId": "stairs",
      "hint": "reward",
      "toRoomId": "combat_6"
    },
    {
      "fromRoomId": "treasure",
      "hint": "reward",
      "toRoomId": "combat_11"
    }
  ],
  "budgets": {
    "enemyThreat": 205.0,
    "lootValue": 467.0
  },
  "edges": [
    {
      "from": "arena",
      "kind": "door",
      "to": "combat_3",
      "dir": "east"
    },
    {
      "from": "arena",
      "kind": "secret",
      "to": "secret_1",
      "dir": "south"
    },
    {
      "from": "boss",
      "kind": "door",
      "to": "courtyard",
      "dir": "east"
    },
    {
      "from": "combat_10",
      "kind": "shortcut",
      "to": "combat_11",
      "dir": "south"
    },
    {
      "from": "combat_10",
      "kind": "secret",
      "to": "secret_2",
      "dir": "east"
    },
    {
      "from": "combat_11",
      "kind": "door",
      "to": "treasure",
      "dir": "east"
    },
    {
      "from": "combat_3",
      "kind": "door",
      "to": "combat_4",
      "dir": "south"
    },
    {
      "from": "combat_4",
      "kind": "door",
      "to": "combat_5",
      "dir": "south"
    },
    {
      "from": "combat_4",
      "kind": "door",
      "to": "combat_7",
      "dir": "east"
    },
    {
      "from": "combat_5",
      "kind": "door",
      "to": "combat_6",
      "dir": "south"
    },
    {
      "from": "combat_5",
      "kind": "door",
      "to": "combat_8",
      "dir": "east"
    },
    {
      "from": "combat_6",
      "kind": "shortcut",
      "to": "combat_9",
      "dir": "east"
    },
    {
      "from": "combat_6",
      "kind": "corridor",
      "to": "stairs",
      "dir": "south"
    },
    {
      "from": "combat_7",
      "kind": "door",
      "to": "combat_10",
      "dir": "east"
    },
    {
      "from": "combat_7",
      "kind": "shortcut",
      "to": "combat_8",
      "dir": "south"
    },
    {
      "from": "combat_8",
      "kind": "door",
      "to": "combat_11",
      "dir": "east"
    },
    {
      "from": "combat_8",
      "kind": "door",
      "to": "combat_9",
      "dir": "south"
    },
    {
      "from": "courtyard",
      "kind": "door",
      "to": "hall",
      "dir": "south"
    },
    {
      "from": "entrance",
      "kind": "door",
      "to": "combat_5",
      "dir": "east"
    },
    {
      "from": "hall",
      "kind": "door",
      "to": "arena",
      "dir": "south"
    }
  ],
  "floorIndex": 1,
  "floorTheme": "plain",
  "floorThemeLabel": "",
  "isFinalFloor": false,
  "landmarks": [
    {
      "kind": "boss_spire",
      "position": {
        "x": -26.0,
        "y": 18.0,
        "z": -62.0
      },
      "scale": {
        "x": 2.0,
        "y": 24.0,
        "z": 2.0
      }
    },
    {
      "kind": "boss_silhouette",
      "position": {
        "x": -26.0,
        "y": 8.0,
        "z": -68.0
      },
      "scale": {
        "x": 6.0,
        "y": 10.0,
        "z": 1.0
      }
    }
  ],
  "locks": [],
  "maxHeightLevel": 1,
  "placements": {
    "boss": {
      "enemyId": "boss_castle_knight",
      "roomId": "boss"
    },
    "cover": [
      {
        "kind": "pillar",
        "offset": {
          "x": 5.26999998092651,
          "y": 0.0,
          "z": 4.21999979019165
        },
        "roomId": "courtyard",
        "size": {
          "x": 1.2,
          "y": 2.4,
          "z": 1.2
        }
      },
      {
        "kind": "chokepoint",
        "offset": {
          "x": -4.92999982833862,
          "y": 0.0,
          "z": -3.74000000953674
        },
        "roomId": "courtyard",
        "size": {
          "x": 1.2,
          "y": 3.6,
          "z": 1.2
        }
      },
      {
        "kind": "pillar",
        "offset": {
          "x": 1.73000001907349,
          "y": 0.0,
          "z": -2.3199999332428
        },
        "roomId": "hall",
        "size": {
          "x": 1.2,
          "y": 2.4,
          "z": 1.2
        }
      },
      {
        "kind": "chokepoint",
        "offset": {
          "x": -2.19000005722046,
          "y": 0.0,
          "z": 2.30999994277954
        },
        "roomId": "hall",
        "size": {
          "x": 1.2,
          "y": 3.6,
          "z": 1.2
        }
      },
      {
        "kind": "pillar",
        "offset": {
          "x": -2.80999994277954,
          "y": 0.0,
          "z": 1.63999998569489
        },
        "roomId": "arena",
        "size": {
          "x": 1.2,
          "y": 2.4,
          "z": 1.2
        }
      },
      {
        "kind": "chokepoint",
        "offset": {
          "x": 3.0699999332428,
          "y": 0.0,
          "z": -2.04999995231628
        },
        "roomId": "arena",
        "size": {
          "x": 1.2,
          "y": 3.6,
          "z": 1.2
        }
      },
      {
        "kind": "pillar",
        "offset": {
          "x": -2.0,
          "y": 0.0,
          "z": -2.0
        },
        "roomId": "combat_3",
        "size": {
          "x": 1.2,
          "y": 2.4,
          "z": 1.2
        }
      },
      {
        "kind": "chokepoint",
        "offset": {
          "x": 2.0,
          "y": 0.0,
          "z": 2.0
        },
        "roomId": "combat_3",
        "size": {
          "x": 1.2,
          "y": 3.6,
          "z": 1.2
        }
      },
      {
        "kind": "pillar",
        "offset": {
          "x": 0.0,
          "y": 0.0,
          "z": -4.0
        },
        "roomId": "combat_3",
        "size": {
          "x": 1.2,
          "y": 2.4,
          "z": 1.2
        }
      },
      {
        "kind": "pillar",
        "offset": {
          "x": 2.9300000667572,
          "y": 0.0,
          "z": -2.25999999046326
        },
        "roomId": "combat_4",
        "size": {
          "x": 1.2,
          "y": 2.4,
          "z": 1.2
        }
      },
      {
        "kind": "chokepoint",
        "offset": {
          "x": -2.73000001907349,
          "y": 0.0,
          "z": 2.27999997138977
        },
        "roomId": "combat_4",
        "size": {
          "x": 1.2,
          "y": 3.6,
          "z": 1.2
        }
      },
      {
        "kind": "pillar",
        "offset": {
          "x": -2.36999988555908,
          "y": 0.0,
          "z": 1.64999997615814
        },
        "roomId": "combat_5",
        "size": {
          "x": 1.2,
          "y": 2.4,
          "z": 1.2
        }
      },
      {
        "kind": "chokepoint",
        "offset": {
          "x": 1.8400000333786,
          "y": 0.0,
          "z": -1.80999994277954
        },
        "roomId": "combat_5",
        "size": {
          "x": 1.2,
          "y": 3.6,
          "z": 1.2
        }
      },
      {
        "kind": "pillar",
        "offset": {
          "x": 2.02999997138977,
          "y": 0.0,
          "z": -3.39000010490417
        },
        "roomId": "combat_6",
        "size": {
          "x": 1.2,
          "y": 2.4,
          "z": 1.2
        }
      },
      {
        "kind": "chokepoint",
        "offset": {
          "x": -1.8400000333786,
          "y": 0.0,
          "z": 3.10999989509583
        },
        "roomId": "combat_6",
        "size": {
          "x": 1.2,
          "y": 3.6,
          "z": 1.2
        }
      },
      {
        "kind": "pillar",
        "offset": {
          "x": 3.60999989509583,
          "y": 0.0,
          "z": -3.00999999046326
        },
        "roomId": "combat_7",
        "size": {
          "x": 1.2,
          "y": 2.4,
          "z": 1.2
        }
      },
      {
        "kind": "chokepoint",
        "offset": {
          "x": -4.21999979019165,
          "y": 0.0,
          "z": 2.66000008583069
        },
        "roomId": "combat_7",
        "size": {
          "x": 1.2,
          "y": 3.6,
          "z": 1.2
        }
      },
      {
        "kind": "pillar",
        "offset": {
          "x": -2.36999988555908,
          "y": 0.0,
          "z": 1.64999997615814
        },
        "roomId": "combat_8",
        "size": {
          "x": 1.2,
          "y": 2.4,
          "z": 1.2
        }
      },
      {
        "kind": "chokepoint",
        "offset": {
          "x": 1.8400000333786,
          "y": 0.0,
          "z": -1.80999994277954
        },
        "roomId": "combat_8",
        "size": {
          "x": 1.2,
          "y": 3.6,